A1: Banrekord 6,1 km
C2: Banrekord nuvarande bansträckning
A3: P18 | B3: ='P18'!G18 -> 2004 | C3: ='P18'!H18 -> 1 | D3: ='P18'!I18 -> Kristoffer Andersson | E3: ='P18'!J18 -> Team Blekinge | F3: ='P18'!K18 -> 19.46
A4: P16 | B4: ='P16'!G26 -> 1990 | C4: ='P16'!H26 -> 1 | D4: ='P16'!I26 -> Mattias Persson | E4: ='P16'!J26 -> KFUM Kristiansstad | F4: ='P16'!K26 -> 20.47
A5: P14 | B5: ='P14'!G26 -> 1995 | C5: ='P14'!H26 -> 1 | D5: ='P14'!I26 -> Linus Studeny | E5: ='P14'!J26 -> Västerviks OK | F5: ='P14'!K26 -> 21.21
A6: F18 | B6: ='F18'!G19 -> 1995 | C6: ='F18'!H19 -> 1 | D6: ='F18'!I19 -> Tove Lindahl | E6: ='F18'!J19 -> Simrishamns AIF | F6: ='F18'!K19 -> 24.01
A7: F16 | B7: ='F16'!G26 -> 2000 | C7: ='F16'!H26 -> 1 | D7: ='F16'!I26 -> Lina Edvardsson | E7: ='F16'!J26 -> HAIS | F7: ='F16'!K26 -> 24.29
A8: F14 | B8: ='F14'!G26 -> 2002 | C8: ='F14'!H26 -> 1 | D8: ='F14'!I26 -> Sandra Nilsson | E8: ='F14'!J26 -> Björnstorps IF | F8: ='F14'!K26 -> 22
A9: MMK | B9: =MMK!G26 -> 1990 | C9: =MMK!H26 -> 1 | D9: =MMK!I26 -> Janus Posycz | E9: =MMK!J26 -> Östra Nyrup | F9: =MMK!K26 -> 19.52
A10: MKK | B10: =MKK!G26 -> 1996 | C10: =MKK!H26 -> 1 | D10: =MKK!I26 -> Tove Lindahl | E10: =MKK!J26 -> Simrishamns AIF | F10: =MKK!K26 -> 23.57