A1: Banrekord 12,6 km
D2: Banrekord nuvarande bansträckning
A3: M | B3: =M!G125 -> 2007 | C3: =M!H125 -> 1 | D3: =M!I125 -> Lars Johansson | E3: =M!J125 -> Enhörna if | F3: =M!K125 -> 39.05
A4: M22 | B4: ='M22'!G52 -> 2001 | C4: ='M22'!H52 -> 1 | D4: ='M22'!I52 -> Anders Hultgren | E4: ='M22'!J52 -> Ryssbergets IK | F4: ='M22'!K52 -> 41.34
A5: M35 | B5: ='M35'!G51 -> 1995 | C5: ='M35'!H51 -> 1 | D5: ='M35'!I51 -> Hans Nilsson | E5: ='M35'!J51 -> Enhörna | F5: ='M35'!K51 -> 40.28
A6: M40 | B6: ='M40'!G33 -> 1990 | C6: ='M40'!H33 -> 1 | D6: ='M40'!I33 -> Karl-Magnus Berg | E6: ='M40'!J33 -> Heleneholms IF | F6: ='M40'!K33 -> 41.57
A7: M45 | B7: ='M45'!G44 -> 1989 | C7: ='M45'!H44 -> 1 | D7: ='M45'!I44 -> Wolfgang Heiler | E7: ='M45'!J44 -> Staffanstorps AI | F7: ='M45'!K44 -> 43.35
A8: M50 | B8: ='M50'!G44 -> 1996 | C8: ='M50'!H44 -> 1 | D8: ='M50'!I44 -> Börje Hammarstedt | E8: ='M50'!J44 -> Malmö Frisksportklubb | F8: ='M50'!K44 -> 44.1
A9: M55 | B9: ='M55'!G32 -> 2002 | C9: ='M55'!H32 -> 1 | D9: ='M55'!I32 -> Kjell-Erik Ståhl | E9: ='M55'!J32 -> Enhörna | F9: ='M55'!K32 -> 44.14
A10: M60 | B10: ='M60'!G32 -> 2000 | C10: ='M60'!H32 -> 1 | D10: ='M60'!I32 -> Ingvar Olausson | E10: ='M60'!J32 -> Heleneholms IF | F10: ='M60'!K32 -> 47.13
A11: M65 | B11: ='M65'!G30 -> 1998 | C11: ='M65'!H30 -> 1 | D11: ='M65'!I30 -> Gunnar Nilsson | E11: ='M65'!J30 -> Heleneholms IF | F11: ='M65'!K30 -> 50.47
A12: M70 | B12: ='M70'!G24 -> 1996 | C12: ='M70'!H24 -> 1 | D12: ='M70'!I24 -> Lars-Olle Andersson | E12: ='M70'!J24 -> IFK Helsingborg | F12: ='M70'!K24 -> 56.47
A13: M75 | B13: ='M75'!G10 -> 2007 | C13: ='M75'!H10 -> 1 | D13: ='M75'!I10 -> Ingmar Nilsson | E13: ='M75'!J10 -> FK Snapphanarna | F13: ='M75'!K10 -> 68.29
A14: M80+ | B14: ='M80+'!G9 -> 2007 | C14: ='M80+'!H9 -> 1 | D14: ='M80+'!I9 -> Joel Larsson | E14: ='M80+'!J9 -> P7 SK IF | F14: ='M80+'!K9 -> 72.55
A16: K | B16: =K!G53 -> 1995 | C16: =K!H53 -> 1 | D16: =K!I53 -> Sara Romée | E16: =K!J53 -> MAI | F16: =K!K53 -> 43.23
A17: K22 | B17: ='K22'!G32 -> 1996 | C17: ='K22'!H32 -> 1 | D17: ='K22'!I32 -> Linda Bjuremar | E17: ='K22'!J32 -> Vittsjö GIF | F17: ='K22'!K32 -> 48.3
A18: K35 | B18: ='K35'!G31 -> 1999 | C18: ='K35'!H31 -> 1 | D18: ='K35'!I31 -> Jorun Rekkedal | E18: ='K35'!J31 -> Ås IL | F18: ='K35'!K31 -> 46.35
A19: K40 | B19: ='K40'!G11 -> 2005 | C19: ='K40'!H11 -> 1 | D19: ='K40'!I11 -> Ingunn Bydinger | E19: ='K40'!J11 -> Ryssbergets IK | F19: ='K40'!K11 -> 50.48
A20: K45 | B20: ='K45'!G25 -> 1989 | C20: ='K45'!H25 -> 1 | D20: ='K45'!I25 -> Kirsti Takkinen | E20: ='K45'!J25 -> LUGI | F20: ='K45'!K25 -> 54.22
A21: K50 | B21: ='K50'!G11 -> 2004 | C21: ='K50'!H11 -> 1 | D21: ='K50'!I11 -> Ulla Engelby | E21: ='K50'!J11 -> Härlövs IF | F21: ='K50'!K11 -> 57.25
A22: K55 | B22: ='K55'!G9 -> 2007 | C22: ='K55'!H9 -> 1 | D22: ='K55'!I9 -> Marianne Söndergaard | E22: ='K55'!J9 -> IK Pallas | F22: ='K55'!K9 -> 63.57
A23: K60 | B23: ='K60'!G10 -> 2004 | C23: ='K60'!H10 -> 1 | D23: ='K60'!I10 -> Kirsti Takkinen | E23: ='K60'!J10 -> Lödde Motion | F23: ='K60'!K10 -> 71.55
A24: K70+ | B24: ='K70+'!G7 -> 2005 | C24: ='K70+'!H7 -> 1 | D24: ='K70+'!I7 -> Ulla Seger | E24: ='K70+'!J7 -> IS Göta | F24: ='K70+'!K7 -> 92.54
A27: MM | B27: =MM!G44 -> 1988 | C27: =MM!H44 -> 1 | D27: =MM!I44 -> Hynek Svoboda | E27: =MM!J44 -> Tetra Pak IF | F27: =MM!K44 -> 44.36
A28: MK | B28: =MK!G31 -> 1990 | C28: =MK!H31 -> 1 | D28: =MK!I31 -> Anna Gurnicka | E28: =MK!J31 -> Östa Nyrup | F28: =MK!K31 -> 50.52