A1: Banrekord 3,4 km
C2: Banrekord nuvarande bansträckning
A3: P12 | B3: ='P12'!G21 -> 2002 | C3: ='P12'!H21 -> 1 | D3: ='P12'!I21 -> Emil Borg | E3: ='P12'!J21 -> Åhus | F3: ='P12'!K21 -> 12.34
A4: P10 | B4: ='P10'!G21 -> 1998 | C4: ='P10'!H21 -> 1 | D4: ='P10'!I21 -> Alexander Nilsson | E4: ='P10'!J21 -> Härlövs IF | F4: ='P10'!K21 -> 12.5
A5: P8 | B5: ='P8'!G21 -> 1992 | C5: ='P8'!H21 -> 1 | D5: ='P8'!I21 -> Torbjörn Frostmyr | E5: ='P8'!J21 -> Staffanstorps AI | F5: ='P8'!K21 -> 14.35
A6: F12 | B6: ='F12'!G21 -> 1995 | C6: ='F12'!H21 -> 1 | D6: ='F12'!I21 -> Mariette Sjöberg | E6: ='F12'!J21 -> MAI | F6: ='F12'!K21 -> 12.15
A7: F10 | B7: ='F10'!G23 -> 1996 | C7: ='F10'!H23 -> 1 | D7: ='F10'!I23 -> Pernilla Sävestrand | E7: ='F10'!J23 -> Göteborgs KIK | F7: ='F10'!K23 -> 13.37
A8: F8 | B8: ='F8'!G21 -> 2003 | C8: ='F8'!H21 -> 1 | D8: ='F8'!I21 -> Amanda Kallmér | E8: ='F8'!J21 -> Ryssbergets IK | F8: ='F8'!K21 -> 15.15