A1: Banrekord 12,6 km
D2: Banrekord nuvarande bansträckning
A3: M | B3: =M!G121 -> 1994 | C3: =M!H121 -> 1 | D3: =M!I121 -> Gert-Inge Nilsson | E3: =M!J121 -> Härlövs IF | F3: =M!K121 -> 39.13
A4: M22 | B4: ='M22'!G50 -> 2001 | C4: ='M22'!H50 -> 1 | D4: ='M22'!I50 -> Anders Hultgren | E4: ='M22'!J50 -> Ryssbergets IK | F4: ='M22'!K50 -> 41.34
A5: M35 | B5: ='M35'!G50 -> 1995 | C5: ='M35'!H50 -> 1 | D5: ='M35'!I50 -> Hans Nilsson | E5: ='M35'!J50 -> Enhörna | F5: ='M35'!K50 -> 40.28
A6: M40 | B6: ='M40'!G32 -> 1990 | C6: ='M40'!H32 -> 1 | D6: ='M40'!I32 -> Karl-Magnus Berg | E6: ='M40'!J32 -> Heleneholms IF | F6: ='M40'!K32 -> 41.57
A7: M45 | B7: ='M45'!G43 -> 1989 | C7: ='M45'!H43 -> 1 | D7: ='M45'!I43 -> Wolfgang Heiler | E7: ='M45'!J43 -> Staffanstorps AI | F7: ='M45'!K43 -> 43.35
A8: M50 | B8: ='M50'!G43 -> 1996 | C8: ='M50'!H43 -> 1 | D8: ='M50'!I43 -> Börje Hammarstedt | E8: ='M50'!J43 -> Malmö Frisksportklubb | F8: ='M50'!K43 -> 44.1
A9: M55 | B9: ='M55'!G31 -> 2002 | C9: ='M55'!H31 -> 1 | D9: ='M55'!I31 -> Kjell-Erik Ståhl | E9: ='M55'!J31 -> Enhörna | F9: ='M55'!K31 -> 44.14
A10: M60 | B10: ='M60'!G31 -> 2000 | C10: ='M60'!H31 -> 1 | D10: ='M60'!I31 -> Ingvar Olausson | E10: ='M60'!J31 -> Heleneholms IF | F10: ='M60'!K31 -> 47.13
A11: M65 | B11: ='M65'!G29 -> 1998 | C11: ='M65'!H29 -> 1 | D11: ='M65'!I29 -> Gunnar Nilsson | E11: ='M65'!J29 -> Heleneholms IF | F11: ='M65'!K29 -> 50.47
A12: M70 | B12: ='M70'!G23 -> 1996 | C12: ='M70'!H23 -> 1 | D12: ='M70'!I23 -> Lars-Olle Andersson | E12: ='M70'!J23 -> IFK Helsingborg | F12: ='M70'!K23 -> 56.47
A13: M75 | B13: ='M75'!G8 -> 2005 | C13: ='M75'!H8 -> 1 | D13: ='M75'!I8 -> Karl Johansson | E13: ='M75'!J8 -> IS Skanne | F13: ='M75'!K8 -> 70.54
A14: M80+ | B14: ='M80+'!G7 -> 2006 | C14: ='M80+'!H7 -> 1 | D14: ='M80+'!I7 -> Joel Larsson | E14: ='M80+'!J7 -> P7 SK IF | F14: ='M80+'!K7 -> 76.43
A16: K | B16: =K!G52 -> 1995 | C16: =K!H52 -> 1 | D16: =K!I52 -> Sara Romée | E16: =K!J52 -> MAI | F16: =K!K52 -> 43.23
A17: K22 | B17: ='K22'!G31 -> 1996 | C17: ='K22'!H31 -> 1 | D17: ='K22'!I31 -> Linda Bjuremar | E17: ='K22'!J31 -> Vittsjö GIF | F17: ='K22'!K31 -> 48.3
A18: K35 | B18: ='K35'!G30 -> 1999 | C18: ='K35'!H30 -> 1 | D18: ='K35'!I30 -> Jorun Rekkedal | E18: ='K35'!J30 -> Ås IL | F18: ='K35'!K30 -> 46.35
A19: K40 | B19: ='K40'!G10 -> 2005 | C19: ='K40'!H10 -> 1 | D19: ='K40'!I10 -> Ingunn Bydinger | E19: ='K40'!J10 -> Ryssbergets IK | F19: ='K40'!K10 -> 50.48
A20: K45 | B20: ='K45'!G24 -> 1989 | C20: ='K45'!H24 -> 1 | D20: ='K45'!I24 -> Kirsti Takkinen | E20: ='K45'!J24 -> LUGI | F20: ='K45'!K24 -> 54.22
A21: K50 | B21: ='K50'!G10 -> 2004 | C21: ='K50'!H10 -> 1 | D21: ='K50'!I10 -> Ulla Engelby | E21: ='K50'!J10 -> Härlövs IF | F21: ='K50'!K10 -> 57.25
A22: K60 | B22: ='K60'!G9 -> 2004 | C22: ='K60'!H9 -> 1 | D22: ='K60'!I9 -> Kirsti Takkinen | E22: ='K60'!J9 -> Lödde Motion | F22: ='K60'!K9 -> 71.55
A23: K70+ | B23: ='K70+'!G6 -> 2005 | C23: ='K70+'!H6 -> 1 | D23: ='K70+'!I6 -> Ulla Seger | E23: ='K70+'!J6 -> IS Göta | F23: ='K70+'!K6 -> 92.54
A26: MM | B26: =MM!G43 -> 1988 | C26: =MM!H43 -> 1 | D26: =MM!I43 -> Hynek Svoboda | E26: =MM!J43 -> Tetra Pak IF | F26: =MM!K43 -> 44.36
A27: MK | B27: =MK!G30 -> 1990 | C27: =MK!H30 -> 1 | D27: =MK!I30 -> Anna Gurnicka | E27: =MK!J30 -> Östa Nyrup | F27: =MK!K30 -> 50.52